{
  "schema_version": "capacity-pilot-result-v1",
  "pilot_scope": "non-counted-pilot",
  "candidate_specific": true,
  "status": "passed",
  "disposition_code": "success",
  "pilot_complete": true,
  "counted_execution_authorized": false,
  "native_execution_established": false,
  "source_commit": "a97cadfe8d9815f4468c67323a98ae2957a2e629",
  "run_id": "r0500000-a000010000-n01",
  "protocol_sha256": "259c453e1149444634782d078d583fc76e77af18dc276b9c80af9f3d7183ac2b",
  "manifest_sha256": "e4dd4fcadc5b4b30212b6c342dbbd2b8a2b02934c705a8ae276d5f66b170d467",
  "transactions_sha256": "cf68b8a8f085aec1f1b16eadbb64f5d00da69a75027f704264a1f445546a7866",
  "samples_sha256": "4fbfe67c07b444b920aead0a4d9eed1ee504f948c215b06c4dfab475799e692d",
  "metrics_summary_sha256": "5f9789935a587e3915ac2745d6903ad0cc9f056551d06bff94b1f63022e9e424",
  "sample_count": 901,
  "transaction_count": 3,
  "thresholds_passed": true,
  "abort_rule_breached": false,
  "controlled_restart_recovered": true,
  "reset_confirmed": true,
  "bindings_validated": true
}
